ID,Product,Food Group,Calories,Protein,Carbohydrate,Fat,Fiber,Total Sugars
781761,Cheese Sandwich American Cheese On Whole Wheat Bread With Mayonnaise,Fast Foods,329,11.87,26.7,19.43,2.8,5.01
781762,Cheese Sandwich Cheddar Cheese On White Bread With Mayonnaise,Fast Foods,366,12.97,26.75,22.82,1.4,3.18
781763,Cheese Sandwich Cheddar Cheese On Wheat Bread With Mayonnaise,Fast Foods,364,14.32,24.61,23.14,2.8,2.92
781764,Cheese Sandwich Cheddar Cheese On Whole Wheat Bread With Mayonnaise,Fast Foods,364,14.32,24.61,23.14,2.8,2.92
781765,Cheese Sandwich Reduced Fat American Cheese On White Bread With Mayonnaise,Fast Foods,307,11.07,29.47,15.86,1.4,5.9
781766,Cheese Sandwich Reduced Fat American Cheese On Wheat Bread With Mayonnaise,Fast Foods,305,12.41,27.33,16.19,2.8,5.65
781767,Cheese Sandwich Reduced Fat American Cheese On Whole Wheat Bread With Mayonnaise,Fast Foods,305,12.41,27.33,16.19,2.8,5.65
781768,Cheese Sandwich Reduced Fat Cheddar Cheese On White Bread With Mayonnaise,Fast Foods,332,14.6,27.1,18.15,1.4,3.1
781769,Cheese Sandwich Reduced Fat Cheddar Cheese On Wheat Bread With Mayonnaise,Fast Foods,330,15.94,24.96,18.47,2.8,2.84
781770,Cheese Sandwich Reduced Fat Cheddar Cheese On Whole Wheat Bread With Mayonnaise,Fast Foods,330,15.94,24.96,18.47,2.8,2.84
781771,Cheese Sandwich American Cheese On White Bread With Butter,Fast Foods,326,10.47,28.81,18.83,1.4,5.2
781772,Cheese Sandwich American Cheese On Wheat Bread With Butter,Fast Foods,325,11.82,26.67,19.16,2.8,4.94
781773,Cheese Sandwich American Cheese On Whole Wheat Bread With Butter,Fast Foods,325,11.82,26.67,19.16,2.8,4.94
781774,Cheese Sandwich Cheddar Cheese On White Bread With Butter,Fast Foods,362,12.93,26.73,22.54,1.4,3.11
781775,Cheese Sandwich Cheddar Cheese On Wheat Bread With Butter,Fast Foods,360,14.27,24.59,22.87,2.8,2.86
781776,Cheese Sandwich Cheddar Cheese On Whole Wheat Bread With Butter,Fast Foods,360,14.27,24.59,22.87,2.8,2.86
781777,Cheese Sandwich Reduced Fat American Cheese On White Bread With Butter,Fast Foods,302,11.02,29.45,15.59,1.4,5.84
781778,Cheese Sandwich Reduced Fat American Cheese On Wheat Bread With Butter,Fast Foods,301,12.37,27.31,15.91,2.8,5.59
781779,Cheese Sandwich Reduced Fat American Cheese On Whole Wheat Bread With Butter,Fast Foods,301,12.37,27.31,15.91,2.8,5.59
781780,Cheese Sandwich Reduced Fat Cheddar Cheese On White Bread With Butter,Fast Foods,327,14.55,27.08,17.87,1.4,3.03
781781,Cheese Sandwich Reduced Fat Cheddar Cheese On Wheat Bread With Butter,Fast Foods,325,15.9,24.94,18.2,2.8,2.78
781782,Cheese Sandwich Reduced Fat Cheddar Cheese On Whole Wheat Bread With Butter,Fast Foods,325,15.9,24.94,18.2,2.8,2.78
781783,Grilled Cheese Sandwich Nfs,Fast Foods,326,10.47,28.81,18.83,1.4,5.2
781784,Grilled Cheese Sandwich American Cheese On White Bread,Fast Foods,326,10.47,28.81,18.83,1.4,5.2
781785,Grilled Cheese Sandwich American Cheese On Wheat Bread,Fast Foods,325,11.82,26.67,19.16,2.8,4.94
781786,Grilled Cheese Sandwich American Cheese On Whole Wheat Bread,Fast Foods,325,11.82,26.67,19.16,2.8,4.94
781787,Grilled Cheese Sandwich Cheddar Cheese On White Bread,Fast Foods,362,12.93,26.73,22.54,1.4,3.11
781788,Grilled Cheese Sandwich Cheddar Cheese On Wheat Bread,Fast Foods,360,14.27,24.59,22.87,2.8,2.86
781789,Grilled Cheese Sandwich Cheddar Cheese On Whole Wheat Bread,Fast Foods,360,14.27,24.59,22.87,2.8,2.86
781790,Grilled Cheese Sandwich Reduced Fat American Cheese On White Bread,Fast Foods,302,11.02,29.45,15.59,1.4,5.84
781791,Grilled Cheese Sandwich Reduced Fat American Cheese On Wheat Bread,Fast Foods,301,12.37,27.31,15.91,2.8,5.59
781792,Grilled Cheese Sandwich Reduced Fat American Cheese On Whole Wheat Bread,Fast Foods,301,12.37,27.31,15.91,2.8,5.59
781793,Grilled Cheese Sandwich Reduced Fat Cheddar Cheese On White Bread,Fast Foods,327,14.55,27.08,17.87,1.4,3.03
781794,Grilled Cheese Sandwich Reduced Fat Cheddar Cheese On Wheat Bread,Fast Foods,325,15.9,24.94,18.2,2.8,2.78
781795,Grilled Cheese Sandwich Reduced Fat Cheddar Cheese On Whole Wheat Bread,Fast Foods,325,15.9,24.94,18.2,2.8,2.78
781796,Cheese Sauce,Soups and Sauces,160,3.24,7.66,13.02,0.3,0.3
781797,Cheese Sauce Made With Lowfat Cheese,Soups and Sauces,125,6.83,7.05,7.72,0.1,3.92
781798,Alfredo Sauce,Soups and Sauces,147,2.68,0.99,15.01,0,0.92
781799,Alfredo Sauce With Added Vegetables,Soups and Sauces,118,2.37,1.93,11.56,0.3,1.34
781800,Alfredo Sauce With Meat,Soups and Sauces,168,6.96,0.8,15.35,0,0.75
781801,Alfredo Sauce With Meat And Added Vegetables,Soups and Sauces,145,6.72,1.57,12.54,0.3,1.09
781802,Alfredo Sauce With Poultry,Soups and Sauces,152,7.35,0.8,13.5,0,0.75
781803,Alfredo Sauce With Poultry And Added Vegetables,Soups and Sauces,128,7.1,1.57,10.69,0.3,1.09
781804,Alfredo Sauce With Seafood,Soups and Sauces,142,6.36,1.36,12.47,0,0.75
781805,Alfredo Sauce With Seafood And Added Vegetables,Soups and Sauces,119,6.12,2.12,9.67,0.3,1.09
781808,Cheddar Cheese Soup Home Recipe Canned Or Ready-To-Serve,Soups and Sauces,67,2.02,8.11,2.99,1.1,4.4
781809,Beer Cheese Soup Made With Milk,Soups and Sauces,192,6.1,6.64,15.33,0.3,0.84
782847,Beef With Soy-Based Sauce,Prepared Meals,184,15.83,3.37,12.21,0.5,1.16
782848,Steak Teriyaki,Prepared Meals,198,28.86,1.94,8.25,0,1.76
782851,Beef With Sweet And Sour Sauce,Prepared Meals,183,11.6,16.28,8.24,0.8,9.2
782861,Sweet And Sour Pork,Prepared Meals,194,11.6,18.09,8.31,0.9,9.26
782868,Pork Or Ham With Soy-Based Sauce,Prepared Meals,187,14.84,3.37,12.52,0.5,1.16
782890,Spaghetti Sauce With Poultry,Soups and Sauces,73,6.3,6.04,2.61,1.5,3.99
782891,Spaghetti Sauce With Poultry And Added Vegetables,Soups and Sauces,68,6.3,5.57,2.37,1.4,3.56
782899,Chicken Or Turkey With Teriyaki,Prepared Meals,163,25.73,1.62,5.96,0,1.47
782923,Spaghetti Sauce With Seafood,Soups and Sauces,63,5.32,6.59,1.58,1.5,3.99
782924,Spaghetti Sauce With Seafood And Added Vegetables,Soups and Sauces,58,5.32,6.13,1.34,1.4,3.56
782926,Sweet And Sour Shrimp,Prepared Meals,168,7.17,15.78,8.53,0.8,9.07
782927,Lobster Sauce,Soups and Sauces,146,8.6,4.21,10.41,0.1,1.57
782928,Oyster Sauce,Soups and Sauces,127,5.5,7.76,8.12,0.2,1.99
782937,Shrimp Teriyaki,Prepared Meals,120,21.62,3.34,1.56,0,1.76
782947,Spaghetti Sauce With Meat,Soups and Sauces,89,5.92,6.04,4.46,1.5,3.99
782948,Spaghetti Sauce With Meat And Added Vegetables,Soups and Sauces,84,5.92,5.57,4.22,1.4,3.56
782970,Beef And Noodles With Soy-Based Sauce,Prepared Meals,171,13.16,7.56,9.91,0.6,0.94
782972,Biryani With Meat,Prepared Meals,144,8.4,12.07,6.77,0.9,1.67
782980,Beef And Rice With Soy-Based Sauce,Prepared Meals,176,13.55,7.98,10.12,0.5,0.97
783023,Chicken Or Turkey And Noodles With Soy-Based Sauce,Prepared Meals,155,11.58,7.62,8.88,0.6,1
783025,Biryani With Chicken,Prepared Meals,102,7.04,13.42,2.36,0.9,1.85
783029,Chicken Or Turkey And Rice With Soy-Based Sauce,Prepared Meals,160,11.93,8.03,9.07,0.5,1.03
783034,Chicken Or Turkey Souffle,Dairy and Egg Products,169,11.7,5.48,11.14,0.1,2.32
783049,Shrimp And Noodles With Soy-Based Sauce,Prepared Meals,139,10.18,8.19,7.11,0.6,0.96
783065,Seafood Souffle,Dairy and Egg Products,151,9.91,5.47,9.83,0.1,2.32
783102,Beef Potatoes And Vegetables Including Carrots Broccoli And/or Dark-Green Leafy; Soy-Based Sauce,Prepared Meals,146,11.65,6.04,8.68,1.2,1.41
783103,Beef Potatoes And Vegetables Excluding Carrots Broccoli And Dark-Green Leafy; Soy-Based Sauce,Prepared Meals,145,11.67,5.84,8.69,0.9,1.55
783106,Beef Chow Mein Or Chop Suey With Noodles,Prepared Meals,130,10.44,12.29,4.18,1.2,2.25
783107,Beef Noodles And Vegetables Including Carrots Broccoli And/or Dark-Green Leafy; Soy-Based Sauce,Prepared Meals,137,10.25,7.7,7.48,1.3,1.35
783108,Beef Noodles And Vegetables Excluding Carrots Broccoli And Dark-Green Leafy; Soy-Based Sauce,Prepared Meals,139,10.51,7.47,7.72,0.9,1.49
783127,Beef Rice And Vegetables Including Carrots Broccoli And/or Dark-Green Leafy; Soy-Based Sauce,Prepared Meals,140,10.49,8.01,7.6,1.2,1.37
783128,Beef Rice And Vegetables Excluding Carrots Broccoli And Dark-Green Leafy; Soy-Based Sauce,Prepared Meals,143,10.76,7.79,7.84,0.8,1.51
783148,Pork Chow Mein Or Chop Suey With Noodles,Prepared Meals,144,10.07,12.29,5.67,1.2,2.25
783149,Pork Rice And Vegetables Including Carrots Broccoli And/or Dark-Green Leafy; Soy-Based Sauce,Prepared Meals,142,9.89,8.01,7.79,1.2,1.37
783150,Pork Rice And Vegetables Excluding Carrots Broccoli And Dark-Green Leafy; Soy-Based Sauce,Prepared Meals,144,10.14,7.79,8.04,0.8,1.51
783155,Sweet And Sour Pork With Rice,Prepared Meals,184,10.16,19.98,7,0.8,7.76
783199,Chicken Or Turkey Chow Mein Or Chop Suey With Noodles,Prepared Meals,131,9.57,12.27,4.72,1.2,2.24
783207,Chicken Or Turkey Rice And Vegetables Including Carrots Broccoli And/or Dark-Green Leafy; Soy-Based Sauce,Prepared Meals,128,9.3,8.05,6.82,1.2,1.42
783208,Chicken Or Turkey Rice And Vegetables Excluding Carrots Broccoli And Dark-Green Leafy; Soy-Based Sauce,Prepared Meals,130,9.53,7.83,7.04,0.8,1.56
783223,Paella With Seafood,Prepared Meals,142,8.04,16.43,4.68,0.8,0.93
783225,Shrimp Chow Mein Or Chop Suey With Noodles,Prepared Meals,118,8.72,12.47,3.33,1.1,2.19
783241,Chow Mein Or Chop Suey Ns As To Type Of Meat With Noodles,Prepared Meals,131,9.57,12.27,4.72,1.2,2.24
783242,Paella Nfs,Prepared Meals,167,9.54,15.8,7.08,0.6,0.67
783244,Chow Mein Or Chop Suey Various Types Of Meat With Noodles,Prepared Meals,135,10.02,12.28,4.86,1.2,2.24
783248,Jambalaya With Meat And Rice,Prepared Meals,178,14.5,8.53,9.48,0.7,0.94
783258,Beef And Vegetables Including Carrots Broccoli And/or Dark-Green Leafy; No Potatoes Soy-Based Sauce,Prepared Meals,141,11.64,4.77,8.7,1.3,1.57
783259,Beef And Broccoli,Prepared Meals,155,10.57,5.32,10.44,1.4,1.39
783260,Beef Tofu And Vegetables Including Carrots Broccoli And/or Dark-Green Leafy; No Potatoes Soy-Based Sauce,Prepared Meals,112,7.22,4.86,7.56,1.3,1.67
783263,Beef Chow Mein Or Chop Suey No Noodles,Prepared Meals,82,10.76,3.85,2.61,0.8,1.76
783264,Kung Pao Beef,Prepared Meals,218,18.35,4.98,14.46,1.1,1.65
783265,Beef And Vegetables Excluding Carrots Broccoli And Dark-Green Leafy; No Potatoes Soy-Based Sauce,Prepared Meals,143,12,4.38,9.02,0.9,1.74
783266,Beef Tofu And Vegetables Excluding Carrots Broccoli  And Dark-Green Leafy; No Potatoes Soy-Based Sauce,Prepared Meals,114,7.4,4.49,7.83,0.9,1.84
783271,Beef Taco Filling: Beef Cheese Tomato Taco Sauce,Prepared Meals,180,12.92,6.44,11.21,0.9,4.08
783272,Stir Fried Beef And Vegetables In Soy Sauce,Prepared Meals,93,10.85,4.26,3.68,0.9,2.6
783284,Pork Tofu And Vegetables Including Carrots Broccoli And/or Dark-Green Leafy; No Potatoes Soy-Base Sauce,Prepared Meals,113,6.92,4.86,7.66,1.3,1.67
783285,Pork And Vegetables Hawaiian Style,Prepared Meals,90,7.48,7.62,3.6,1.8,2.72
783286,Pork And Watercress With Soy-Based Sauce,Prepared Meals,143,11.42,3.54,9.35,0.5,1.72
783287,Kung Pao Pork,Prepared Meals,221,17.31,4.98,14.78,1.1,1.65
783288,Moo Shu Pork Without Chinese Pancake,Prepared Meals,151,10.53,4.25,10.4,0.9,1.9
783289,Pork And Onions With Soy-Based Sauce,Prepared Meals,147,11.03,5.45,9.02,0.8,2.25
783294,Pork Tofu And Vegetables Excluding Carrots Broccoli And Dark-Green Leafy; No Potatoes Soy-Based Sauce,Prepared Meals,114,7.09,4.49,7.93,0.9,1.84
783295,Pork Chow Mein Or Chop Suey No Noodles,Prepared Meals,98,10.34,3.85,4.3,0.8,1.76
783301,Pork And Vegetables Including Carrots Broccoli And/or Dark-Green Leafy; No Potatoes Soy-Based Sauce,Prepared Meals,142,10.95,4.77,8.91,1.3,1.57
783302,Pork And Vegetables Excluding Carrots Broccoli And Dark- Green Leafy; No Potatoes Soy-Based Sauce,Prepared Meals,145,11.28,4.38,9.24,0.9,1.74
783323,Chicken Or Turkey And Vegetables Excluding Carrots Broccoli And Dark-Green Leafy; No Potatoes Soy-Based Sauce,Prepared Meals,129,10.57,4.43,8.09,0.9,1.8
783327,Moo Goo Gai Pan,Prepared Meals,74,7.28,6.39,2.41,1.4,2.48
783329,Almond Chicken,Prepared Meals,197,16.08,4.88,13.18,1.2,1.63
783330,Chicken Or Turkey Chow Mein Or Chop Suey No Noodles,Prepared Meals,83,9.78,3.84,3.23,0.8,1.76
783359,Shrimp Chow Mein Or Chop Suey No Noodles,Prepared Meals,69,8.8,4.27,1.69,0.8,1.72
783385,Shrimp And Vegetables Including Carrots Broccoli And/or Dark-Green Leafy; No Potatoes Soy-Based Sauce,Prepared Meals,113,9.08,5.27,6.28,1.3,1.57
783386,Shrimp And Vegetables Excluding Carrots Broccoli And Dark-Green Leafy; No Potatoes Soy-Based Sauce,Prepared Meals,114,9.34,4.9,6.51,0.9,1.74
783389,Kung Pao Shrimp,Prepared Meals,175,14.35,5.75,10.76,1.1,1.65
783391,Shellfish Mixture And Vegetables Including Carrots Broccoli And/or Dark-Green Leafy; No Potatoes Soy-Based Sauce,Prepared Meals,117,9.33,6.01,6.26,1.3,1.57
783392,Shellfish Mixture And Vegetables Excluding Carrots Broccoli And Dark-Green Leafy; No Potatoes Soy-Based Sauce,Prepared Meals,118,9.6,5.67,6.49,0.9,1.74
783397,Fish And Vegetables Including Carrots Broccoli And/or Dark-Green Leafy; No Potatoes Soy-Based Sauce,Prepared Meals,101,7.71,4.75,5.87,1.3,1.57
783398,Fish And Vegetables Excluding  Carrots Broccoli And Dark-Green Leafy; No Potatoes Soy-Based Sauce,Prepared Meals,102,7.91,4.36,6.08,0.9,1.74
783404,Chow Mein Or Chop Suey Ns As To Type Of Meat No Noodles,Prepared Meals,83,9.78,3.84,3.23,0.8,1.76
783413,Sandwich Nfs,Fast Foods,301,10.47,32.9,13.79,1.7,5.01
783414,Meat Sandwich Nfs,Fast Foods,301,10.47,32.9,13.79,1.7,5.01
783415,Wrap Sandwich Filled With Meat Poultry Or Fish Vegetables And Cheese,Fast Foods,205,12.38,13.96,11.19,1.1,2.68
783416,Wrap Sandwich Filled With Meat Poultry Or Fish And Vegetables,Fast Foods,187,12.78,13.36,9.3,1.2,2.12
783417,Beef Sandwich Nfs,Fast Foods,190,11.93,18.68,7.33,0.6,2.86
783418,Beef Barbecue Sandwich Or Sloppy Joe On Bun,Fast Foods,233,10.28,32.93,6.26,0.9,16.34
783419,Beef Barbecue Submarine Sandwich On Bun,Fast Foods,221,16.73,26.04,5.37,0.8,8.72
783420,Cheeseburger 1 Miniature Patty Plain On Miniature Bun From Fast Food / Restaurant,Fast Foods,298,16.23,24.98,14.37,0.9,3.93
783421,Cheeseburger 1 Miniature Patty With Condiments On Miniature Bun From Fast Food / Restaurant,Fast Foods,264,12.91,21.7,13.76,0.9,4.6
783422,Cheeseburger 1 Miniature Patty On Miniature Bun From School,Fast Foods,250,19.73,21.32,9.26,2.9,2.14
783423,Cheeseburger Nfs,Fast Foods,233,14.44,15.62,12.21,0.7,3.42
783427,Cheeseburger 1 Small Patty With Condiments On Bun From Fast Food / Restaurant (Burger King Whopper Jr. With Cheese),Fast Foods,225,11.2,18.11,11.88,0.9,4.14
783431,Cheeseburger 1 Small Patty With Condiments On Bun From Fast Food / Restaurant (Wendy's Jr. Cheeseburger Deluxe),Fast Foods,225,11.2,18.11,11.88,0.9,4.14
783432,Cheeseburger On Bun From School,Fast Foods,244,19.27,22.17,8.39,3.1,2.24
783433,Cheeseburger 1 Small Patty Plain On White Bun,Fast Foods,288,18.81,19.58,14.41,0.7,3.11
783434,Cheeseburger 1 Small Patty Plain On Wheat Bun,Fast Foods,282,19.45,17.76,14.43,2,2.32
783435,Cheeseburger 1 Small Patty With Condiments On White Bun,Fast Foods,227,13.51,15.8,11.94,0.8,3.62
783436,Cheeseburger 1 Small Patty With Condiments On Wheat Bun,Fast Foods,223,13.95,14.52,11.96,1.7,3.06
783437,Cheeseburger 1 Small Patty With Condiments On Whole Wheat Bun,Fast Foods,223,13.95,14.52,11.96,1.7,3.06
783444,Cheeseburger 1 Medium Patty Plain On White Bun,Fast Foods,286,19.18,18.69,14.36,0.7,2.94
783445,Cheeseburger 1 Medium Patty Plain On Wheat Bun,Fast Foods,280,19.78,16.95,14.38,1.9,2.17
783446,Cheeseburger 1 Medium Patty Plain On Whole Wheat Bun,Fast Foods,280,19.78,16.95,14.38,1.9,2.17
783447,Cheeseburger 1 Medium Patty With Condiments On White Bun,Fast Foods,233,14.44,15.62,12.21,0.7,3.42
783448,Cheeseburger 1 Medium Patty With Condiments On Wheat Bun,Fast Foods,228,14.89,14.32,12.23,1.7,2.86
783449,Cheeseburger 1 Medium Patty With Condiments On Whole Wheat Bun,Fast Foods,228,14.89,14.32,12.23,1.7,2.86
783450,Cheeseburger 1 Large Patty Plain On Bun From Fast Food / Restaurant,Fast Foods,300,18.61,16.01,17.49,0.5,2.61
783451,Cheeseburger 1 Large Patty With Condiments On Bun From Fast Food / Restaurant,Fast Foods,219,12.05,12.6,13.26,0.7,3.43
783452,Bacon Cheeseburger 1 Small Patty With Condiments On Bun From Fast Food / Restaurant,Fast Foods,287,15.2,23.47,14.76,1.7,4.8
783453,Bacon Cheeseburger 1 Small Patty With Condiments On Bun From Fast Food / Restaurant (Wendy's Jr. Bacon Cheeseburger),Fast Foods,272,14.81,23.02,13.48,1.3,4.68
783454,Bacon Cheeseburger 1 Medium Patty Plain On Bun From Fast Food / Restaurant,Fast Foods,325,18.89,21.91,17.81,1.5,4.22
783455,Bacon Cheeseburger 1 Medium Patty With Condiments On Bun From Fast Food / Restaurant,Fast Foods,282,16.48,18.5,15.8,1.1,3.36
783456,Bacon Cheeseburger 1 Medium Patty Plain On White Bun,Fast Foods,302,20.47,17.2,16.18,0.6,2.68
783457,Bacon Cheeseburger 1 Medium Patty With Condiments On White Bun,Fast Foods,248,15.74,14.69,13.74,0.7,3.2
783458,Bacon Cheeseburger 1 Medium Patty With Condiments On Wheat Bun,Fast Foods,244,16.16,13.48,13.75,1.6,2.67
783459,Bacon Cheeseburger 1 Medium Patty With Condiments On Whole Wheat Bun,Fast Foods,244,16.16,13.48,13.75,1.6,2.67
783460,Bacon Cheeseburger 1 Large Patty With Condiments On Bun From Fast Food / Restaurant,Fast Foods,237,13.6,11.83,14.82,0.7,3.18
783461,Double Cheeseburger 2 Small Patties Plain On Bun From Fast Food / Restaurant,Fast Foods,305,18.2,20.8,16.56,1.5,3.62
783468,Double Cheeseburger 2 Medium Patties Plain On Bun From Fast Food / Restaurant,Fast Foods,305,19.25,15.88,17.96,1.1,3.08
783472,Double Bacon Cheeseburger 2 Small Patties With Condiments On Bun From Fast Food / Restaurant (Burger King Bacon Double Cheeseburger),Fast Foods,255,14.89,13.77,15.27,0.7,3.12
783473,Double Bacon Cheeseburger 2 Medium Patties Plain On Bun From Fast Food / Restaurant,Fast Foods,311,20.45,11.6,19.77,0.4,1.93
783474,Double Bacon Cheeseburger 2 Medium Patties With Condiments On Bun From Fast Food / Restaurant,Fast Foods,271,17.07,10.78,17.4,0.5,2.43
783475,Double Bacon Cheeseburger 2 Medium Patties With Condiments On Bun From Fast Food / Restaurant (Wendy's Baconator),Fast Foods,271,17.07,10.78,17.4,0.5,2.43
783476,Double Bacon Cheeseburger 2 Large Patties With Condiments On Bun From Fast Food / Restaurant,Fast Foods,293,17.3,16.99,17.32,0.8,3.91
783477,Triple Cheeseburger 3 Medium Patties With Condiments On Bun From Fast Food / Restaurant,Fast Foods,284,17.54,14.55,17.26,0.8,3.37
783478,Hamburger 1 Miniature Patty Plain On Miniature Bun From Fast Food / Restaurant,Fast Foods,286,15.3,29.24,11.38,1,4.25
783479,Hamburger 1 Miniature Patty With Condiments On Miniature Bun From Fast Food / Restaurant,Fast Foods,250,11.7,24.38,11.43,1,4.95
783480,Hamburger 1 Miniature Patty On Miniature Bun From School,Fast Foods,237,18.14,24.91,6.94,3.5,2.53
783481,Hamburger Nfs,Fast Foods,220,13.8,16.76,10.5,0.8,3.53
783485,Hamburger 1 Small Patty With Condiments On Bun From Fast Food / Restaurant (Burger King Whopper Jr.),Fast Foods,207,9.88,20.01,9.53,1,4.39
783488,Hamburger On Bun From School,Fast Foods,237,18.39,24.14,7.09,3.4,2.45
783489,Hamburger 1 Small Patty Plain On White Bun,Fast Foods,275,18.48,22.28,11.84,0.8,3.24
783490,Hamburger 1 Small Patty Plain On Wheat Bun,Fast Foods,268,19.23,20.13,11.86,2.4,2.3
783491,Hamburger 1 Small Patty Plain On Whole Wheat Bun,Fast Foods,268,19.23,20.13,11.86,2.4,2.3
783492,Hamburger 1 Small Patty With Condiments On White Bun,Fast Foods,211,12.65,17.15,9.93,0.9,3.76
783493,Hamburger 1 Small Patty With Condiments On Whole Wheat Bun,Fast Foods,206,13.15,15.72,9.94,1.9,3.14
783498,Hamburger 1 Medium Patty Plain On White Bun,Fast Foods,275,18.96,20.74,12.28,0.7,3.01
783499,Hamburger 1 Medium Patty Plain On Wheat Bun,Fast Foods,268,19.66,18.74,12.3,2.2,2.14
783500,Hamburger 1 Medium Patty Plain On Whole Wheat Bun,Fast Foods,268,19.66,18.74,12.3,2.2,2.14
783501,Hamburger 1 Medium Patty With Condiments On White Bun,Fast Foods,220,13.8,16.76,10.5,0.8,3.53
783502,Hamburger 1 Medium Patty With Condiments On Wheat Bun,Fast Foods,215,14.3,15.33,10.52,1.9,2.91
783503,Hamburger 1 Medium Patty With Condiments On Whole Wheat Bun,Fast Foods,215,14.3,15.33,10.52,1.9,2.91
783504,Double Hamburger 2 Small Patties Plain On Bun From Fast Food / Restaurant,Fast Foods,288,17.75,19.67,14.72,0.7,2.86
783505,Double Hamburger 2 Small Patties With Condiments On Bun From Fast Food / Restaurant,Fast Foods,225,12.65,15.8,12.12,0.8,3.46
783506,Double Hamburger 2 Medium Patties Plain On Bun From Fast Food / Restaurant,Fast Foods,290,19.38,13.64,16.9,0.5,1.98
783511,Chiliburger With Or Without Cheese On Bun,Fast Foods,252,15.54,18.48,12.62,1.2,2.63
783512,Corned Beef Sandwich,Fast Foods,206,14.31,19.87,7.28,1.3,2.45
783513,Reuben Sandwich Corned Beef Sandwich With Sauerkraut And Cheese With Spread,Fast Foods,285,12.58,19.32,17.25,2.2,3.89
783514,Pastrami Sandwich,Fast Foods,165,12.2,20.01,3.66,1.3,2.49
783516,Roast Beef Sandwich With Gravy,Fast Foods,221,11.99,13.92,12.78,0.8,1.47
783517,Roast Beef Submarine Sandwich With Lettuce Tomato And Spread,Fast Foods,181,11.64,19.4,6.16,0.7,2.88
783518,Roast Beef Submarine Sandwich With Cheese Lettuce Tomato And Spread,Fast Foods,190,11.93,18.68,7.33,0.6,2.86
783519,Roast Beef Sandwich With Cheese,Fast Foods,326,18.07,17.3,19.96,0.9,2.11
783520,Roast Beef Sandwich With Bacon And Cheese Sauce,Fast Foods,346,18.82,19.67,20.77,0.7,2.97
783521,Roast Beef Submarine Sandwich On Roll Au Jus,Fast Foods,239,12.34,17.54,12.78,0.6,2.55
783522,Steak Submarine Sandwich With Lettuce And Tomato,Fast Foods,202,15.83,20.31,5.95,0.9,3.27
783523,Steak Sandwich Plain On Roll,Fast Foods,232,21.64,16.5,8.12,0.6,2.4
783525,Steak And Cheese Sandwich Plain On Roll,Fast Foods,248,19.7,18.13,10.24,0.6,3.46
783526,Steak And Cheese Submarine Sandwich Plain On Roll,Fast Foods,252,18.59,21.68,9.53,0.7,3.88
783527,Fajita-Style Beef Sandwich With Cheese On Pita Bread With Lettuce And Tomato,Fast Foods,160,9.1,15.34,6.91,1.2,1.84
783528,Steak And Cheese Submarine Sandwich With Fried Peppers And Onions On Roll,Fast Foods,232,16.26,18.21,10.07,0.9,3.07
783529,Steak Sandwich Plain On Biscuit,Fast Foods,287,13.63,36.63,9.37,0.9,2.37
783530,Gyro Sandwich (Pita Bread Beef Lamb Onion Condiments) With Tomato And Spread,Fast Foods,167,11.91,18.44,4.77,1,1.54
783531,Wrap Sandwich Filled With Beef Patty Cheese And Spread And/or Sauce,Fast Foods,270,12.79,18.88,15.57,1.4,2.74
783532,Bacon Sandwich With Spread,Fast Foods,356,17.12,30.51,17.85,1.6,3.46
783533,Bacon And Cheese Sandwich With Spread,Fast Foods,313,13.44,26.22,16.9,1.2,5.38
783535,Bacon And Egg Sandwich,Fast Foods,237,12.39,21.75,10.66,1.1,3.02
783536,Bacon Lettuce And Tomato Sandwich With Spread,Fast Foods,207,7.46,21.2,10.28,1.6,3.43
783538,Bacon Lettuce Tomato And Cheese Submarine Sandwich With Spread,Fast Foods,233,10.97,15.7,13.96,1.3,1.38
783539,Bacon Chicken And Tomato Club Sandwich On Multigrain Roll With Lettuce And Spread,Fast Foods,223,18.08,12.18,11.2,1.2,2.35
783540,Bacon Breaded Fried Chicken Fillet And Tomato Club With Lettuce And Spread,Fast Foods,257,12.4,20.84,13.83,1.7,1.55
783542,Bacon On Biscuit,Fast Foods,355,9.75,47.19,14.11,1.1,3.04
783544,Ham Sandwich With Spread,Fast Foods,241,12.07,24.99,9.94,1.9,2.69
783545,Ham Sandwich With Lettuce And Spread,Fast Foods,215,11.39,23.7,8,1.9,2.67
783546,Ham And Cheese Sandwich With Lettuce And Spread,Fast Foods,232,12.25,21,10.74,1.5,3.32
783547,Ham And Egg Sandwich,Fast Foods,219,12.22,22.36,8.54,1.4,2.58
783548,Ham Salad Sandwich,Fast Foods,221,11.47,20.01,10.24,1.3,2.84
783549,Ham And Cheese Sandwich With Spread Grilled,Fast Foods,255,13.26,22.89,12.06,1.6,3.51
783550,Ham And Cheese Sandwich On Bun With Lettuce And Spread,Fast Foods,213,11.78,17.01,10.62,1.1,3.42
783551,Hot Ham And Cheese Sandwich On Bun,Fast Foods,213,10.76,16.18,11.45,1.2,3.11
783552,Ham And Cheese On English Muffin,Fast Foods,254,16.9,18.91,12.16,1.4,1.87
783554,Cuban Sandwich With Spread,Fast Foods,274,17.79,22.66,12.01,0.8,3.27
783555,Midnight Sandwich With Spread,Fast Foods,235,17.26,20.13,9,0.7,4.37
783556,Pork Sandwich On White Roll With Onions Dill Pickles And Barbecue Sauce,Fast Foods,223,13.65,26.52,6.46,0.9,9.04
783557,Pork Barbecue Sandwich Or Sloppy Joe On Bun,Fast Foods,209,11.6,30.17,4.2,0.8,16.04
783558,Pork Sandwich,Fast Foods,232,18.16,24.45,6.26,1.3,2.8
783559,Pork Sandwich With Gravy,Fast Foods,149,10.91,16.51,3.96,0.9,2.51
783560,Ham And Tomato Club Sandwich With Lettuce And Spread,Fast Foods,237,10.83,19.39,12.98,1.4,4.06
783561,Chicken Sandwich With Spread,Fast Foods,223,17.8,23.59,6.23,1.3,2.73
783562,Chicken Sandwich With Cheese And Spread,Fast Foods,236,17.54,21.35,8.78,1.1,3.26
783563,Chicken Salad Or Chicken Spread Sandwich,Fast Foods,230,13.14,19.86,10.8,1.3,2.48
783564,Chicken Barbecue Sandwich,Fast Foods,222,17.14,26.14,4.91,1.3,5.83
783568,Chicken Fillet Breaded Fried Sandwich With Cheese Lettuce Tomato And Spread,Fast Foods,286,11.66,25.03,15.41,1.3,3.29
783569,Chicken Patty Sandwich Miniature With Spread,Fast Foods,302,13.97,30.03,13.87,1.4,3.32
783570,Chicken Patty Sandwich Or Biscuit,Fast Foods,308,11.99,37.59,12.33,1.3,2.11
783572,Fajita-Style Chicken Sandwich With Cheese On Pita Bread With Lettuce And Tomato,Fast Foods,156,10.52,15.26,5.74,1.2,1.84
783574,Chicken Patty Sandwich With Cheese On Wheat Bun With Lettuce Tomato And Spread,Fast Foods,254,11.9,24.57,12.68,3.1,4.04
783576,Chicken Fillet Broiled Sandwich On Whole Wheat Roll With Lettuce Tomato And Spread,Fast Foods,204,16.17,19.64,7,3,3.57
783577,Chicken Fillet Broiled Sandwich With Cheese On Whole Wheat Roll With Lettuce Tomato And Non-Mayonnaise Type Spread,Fast Foods,198,16.13,19.46,6.46,2.7,5
783578,Chicken Fillet Broiled Sandwich On Oat Bran Bun With Lettuce Tomato Spread,Fast Foods,201,16.48,16.92,7.04,1.6,3.18
783584,Buffalo Chicken Submarine Sandwich,Fast Foods,186,9.79,19.12,7.81,1.1,2.71
