ID,Product,Food Group,Calories,Protein,Carbohydrate,Fat,Fiber,Total Sugars
785551,Cream Of Wheat Instant Made With Water Fat Not Added In Cooking,Breakfast Cereals,66,1.52,14.43,0.2,0.5,3.64
785552,Wheat Cream Of Cooked Made With Milk And Sugar Puerto Rican Style,Breakfast Cereals,109,3.95,18.84,1.95,0.4,11.24
785553,Cream Of Wheat Instant Made With Water Fat Added In Cooking,Breakfast Cereals,81,1.5,14.08,2.01,0.5,3.55
785554,Cream Of Wheat Instant Made With Water Ns As To Fat Added In Cooking,Breakfast Cereals,81,1.5,14.08,2.01,0.5,3.55
785555,Cream Of Wheat Instant Made With Milk Fat Added In Cooking,Breakfast Cereals,121,4.11,17.96,3.65,0.5,7.62
785556,Cream Of Wheat Instant Made With Milk Fat Not Added In Cooking,Breakfast Cereals,108,4.2,18.41,1.88,0.5,7.81
785557,Cream Of Wheat Instant Made With Milk Ns As To Fat Added In Cooking,Breakfast Cereals,121,4.11,17.96,3.65,0.5,7.62
785558,Cream Of Wheat Instant Made With Non-Dairy Milk Ns As To Fat Added In Cooking,Breakfast Cereals,106,2.39,17.24,3.01,0.6,6.15
785559,Cream Of Wheat Instant Made With Non-Dairy Milk Fat Not Added In Cooking,Breakfast Cereals,92,2.44,17.67,1.23,0.6,6.3
785560,Cream Of Wheat Instant Made With Non-Dairy Milk Fat Added In Cooking,Breakfast Cereals,106,2.39,17.24,3.01,0.6,6.15
785565,Whole Wheat Cereal Cooked Ns As To Fat Added In Cooking,Breakfast Cereals,60,1.53,10.21,1.81,1.3,0.06
785566,Whole Wheat Cereal Cooked Fat Not Added In Cooking,Breakfast Cereals,47,1.55,10.39,0.28,1.3,0.06
785567,Whole Wheat Cereal Cooked Fat Added In Cooking,Breakfast Cereals,60,1.53,10.21,1.81,1.3,0.06
785568,Wheat Cereal Chocolate Flavored Cooked,Breakfast Cereals,49,1.79,11.02,0.47,1.7,0.08
785572,Cream Of Rye,Breakfast Cereals,41,1.28,8.86,0.18,1.4,0.13
785574,Cereal Oat Nfs,Breakfast Cereals,376,12.09,73.23,6.73,9.4,4.36
785575,Cereal Ready-To-Eat Nfs,Breakfast Cereals,374,8.92,79.48,4.86,6.8,22.11
785579,Cereal (General Mills Cheerios Apple Cinnamon),Breakfast Cereals,386,8.3,79.9,6.09,7.3,34.2
785582,Cereal (General Mills Cheerios Banana Nut),Breakfast Cereals,375,5.5,84.69,4,6.1,33.09
785583,Cereal (General Mills Basic 4),Breakfast Cereals,358,6.69,79.09,4,9.1,22.5
785584,Cereal (General Mills Kix Berry Berry),Breakfast Cereals,376,6.19,83.9,4.19,5.8,21
785585,Cereal (General Mills Cheerios Berry Burst),Breakfast Cereals,378,8.8,80.5,4.5,7.6,27
785587,Cereal (General Mills Boo Berry),Breakfast Cereals,386,5.5,85.4,4.3,4.2,27.29
785593,Cereal (General Mills Cheerios),Breakfast Cereals,376,12.09,73.23,6.73,9.4,4.36
785594,Cereal (General Mills Chex Chocolate),Breakfast Cereals,412,4.8,81.09,8.39,2,26.2
785595,Cereal (General Mills Chex Cinnamon),Breakfast Cereals,403,5,82.4,6.59,2.4,26.1
785596,Cereal (General Mills Cheerios Chocolate),Breakfast Cereals,380,5.8,83.5,5.09,6.2,34.09
785598,Cereal (General Mills Lucky Charms Chocolate),Breakfast Cereals,381,5.59,84.4,4.4,5.3,36.79
785599,Cereal (Kellogg's Cinnabon),Breakfast Cereals,410,5.69,83.3,7.3,3.9,41.59
785600,Cereal (General Mills Cinnamon Toast Crunch),Breakfast Cereals,410,5.45,77.99,10.25,6.8,30.3
785602,Cereal (General Mills Honey Nut Clusters),Breakfast Cereals,374,7.7,85.2,2,6.3,24.8
785603,Cereal (Kellogg's Cocoa Krispies),Breakfast Cereals,389,4.6,87.9,2.7,1.4,38.6
785605,Cereal (General Mills Cocoa Puffs),Breakfast Cereals,383,5.6,83.7,5.2,5.7,37.2
785606,Cereal (General Mills 25% Less Sugar Cocoa Puffs),Breakfast Cereals,380,6.5,82.69,5.19,6.7,25.79
785607,Cereal (General Mills Cookie Crisp),Breakfast Cereals,380,5.2,84.5,4.4,5.1,34.8
785609,Cereal (General Mills Chex Corn),Breakfast Cereals,370,6.4,85,2.4,4.7,11.1
785610,Cereal Corn Flakes,Breakfast Cereals,357,7.5,84.1,0.4,3.3,9.5
785611,Cereal (Kellogg's Corn Flakes),Breakfast Cereals,357,7.5,84.1,0.4,3.3,9.5
785613,Cereal (General Mills Count Chocula),Breakfast Cereals,383,5.4,84.5,4.69,5,33.09
785616,Cereal (Kellogg's Crispix),Breakfast Cereals,378,6.59,87.19,0.8,1,12.8
785617,Cereal Crispy Brown Rice,Breakfast Cereals,394,6.69,86.22,1.26,0.7,12.12
785629,Cereal (General Mills Frankenberry),Breakfast Cereals,386,5.5,85.4,4.3,4.2,27.29
785631,Cereal (Kellogg's Froot Loops Marshmallow),Breakfast Cereals,376,4.59,89.3,2.79,7.4,49.9
785632,Cereal (General Mills Cheerios Frosted),Breakfast Cereals,376,9,79.8,4.69,7.5,32
785634,Cereal Frosted Rice,Breakfast Cereals,384,4.3,91.3,0.4,0.5,40.2
785635,Cereal (Kellogg's Frosted Krispies),Breakfast Cereals,384,4.3,91.3,0.4,0.5,40.2
785640,Cereal (General Mills Cheerios Fruity),Breakfast Cereals,381,5.8,84.19,4.59,5.9,32.2
785642,Cereal (General Mills Golden Grahams),Breakfast Cereals,374,5.3,85.1,3.2,5.6,35
785643,Cereal Granola,Breakfast Cereals,381,9,80.1,5.2,7.4,27.9
785645,Cereal (Kellogg's Low Fat Granola),Breakfast Cereals,389,8.7,80.9,5.7,7,28.3
785646,Cereal (Kellogg's Low Fat Granola With Raisins),Breakfast Cereals,381,9,80.1,5.2,7.4,27.9
785657,Cereal (Kellogg's Honey Crunch Corn Flakes),Breakfast Cereals,385,6.8,87,1.9,3.4,33
785658,Cereal (General Mills Chex Honey Nut),Breakfast Cereals,375,6.3,86.67,2,3.9,28.1
785659,Cereal (General Mills Cheerios Honey Nut),Breakfast Cereals,376,8.85,79.69,5,7.1,32.89
785661,Cereal (Kellogg's Honey Smacks),Breakfast Cereals,380,5.7,88.5,2.2,5,56.2
785669,Cereal (Kashi Heart To Heart Oat Flakes And Blueberry Clusters),Breakfast Cereals,376,10.39,80.3,3.79,7.4,22.7
785676,Cereal (General Mills Lucky Charms),Breakfast Cereals,380,7.67,80.89,5.02,5,36.13
785678,Cereal (Malt-O-Meal Blueberry Muffin Tops),Breakfast Cereals,374,5.3,85.1,3.2,5.6,35
785684,Cereal (Malt-O-Meal Crispy Rice),Breakfast Cereals,381,6.75,85.05,2.05,0.4,9.87
785688,Cereal (Malt-O-Meal Honey Graham Squares),Breakfast Cereals,374,5.3,85.1,3.2,5.6,35
785689,Cereal (Malt-O-Meal Honey Nut Toasty O's),Breakfast Cereals,376,8.85,79.69,5,7.1,32.89
785692,Cereal (Malt-O-Meal Golden Puffs),Breakfast Cereals,380,5.7,88.5,2.2,5,56.2
785693,Cereal (Malt-O-Meal Toasted Oat Cereal),Breakfast Cereals,376,12.09,73.23,6.73,9.4,4.36
785697,Cereal Muesli,Breakfast Cereals,355,8.6,74.9,5.4,7.7,25.1
785698,Cereal (General Mills Cheerios Multigrain),Breakfast Cereals,370,8.3,81.4,4.09,8.7,21.2
785699,Cereal (Nature Valley Granola),Breakfast Cereals,381,7.9,79.4,4.69,5,31.89
785702,Cereal (General Mills Cheerios Oat Cluster Crunch),Breakfast Cereals,378,8.5,80.7,4.6,7,27.9
785703,Cereal (General Mills Cheerios Protein),Breakfast Cereals,378,12.26,76.19,5.08,7.1,29.43
785704,Cereal (General Mills Oatmeal Crisp With Almonds),Breakfast Cereals,390,9.89,78.09,6.69,8.2,22.89
785705,Cereal (General Mills Oatmeal Crisp With Raisins),Breakfast Cereals,372,8.5,80.8,3.79,7.5,27.29
785710,Cereal (Kellogg's Product 19),Breakfast Cereals,374,8.5,84.3,1.3,2.8,12.5
785721,Cereal (General Mills Reese's Puffs),Breakfast Cereals,413,6.8,75.6,11.1,4.7,35.3
785722,Cereal (General Mills Chex Rice),Breakfast Cereals,375,6.4,85.09,1.89,2,8
785723,Cereal Rice Flakes,Breakfast Cereals,394,6.69,86.22,1.26,0.7,12.12
785724,Cereal (Kellogg's Rice Krispies),Breakfast Cereals,381,6.75,85.05,2.05,0.4,9.87
785725,Cereal (Kellogg's Rice Krispies Treats Cereal),Breakfast Cereals,395,4.3,85.59,4.19,0.4,29.6
785728,Cereal (Kellogg's Smart Start Strong),Breakfast Cereals,371,7.5,86.8,1.5,5.4,27.79
785729,Cereal (Kellogg's Special K),Breakfast Cereals,377,17.79,73.4,1.79,1.4,12.69
785730,Cereal (Kellogg's Special K Blueberry),Breakfast Cereals,363,6.9,86.3,1.5,8.6,26.7
785732,Cereal (Kellogg's Special K Low Fat Granola),Breakfast Cereals,389,8.7,80.9,5.7,7,28.3
785737,Cereal (Kellogg's Corn Pops),Breakfast Cereals,387,4.8,89.7,1.3,8.4,31.3
785738,Cereal Frosted Corn Flakes,Breakfast Cereals,369,3.96,89.2,1.68,2.2,35.43
785739,Cereal (Kellogg's Frosted Flakes),Breakfast Cereals,369,3.96,89.2,1.68,2.2,35.43
785740,Cereal (Kellogg's Frosted Flakes Reduced Sugar),Breakfast Cereals,357,5.59,87.3,0.4,10.1,23.89
785744,Cereal (General Mills Trix),Breakfast Cereals,384,4.9,86.19,3.79,3.9,32
785745,Cereal (General Mills 25% Less Sugar Trix),Breakfast Cereals,383,5.4,85.5,4,4.3,25
785753,Cereal Puffed Wheat Sweetened,Breakfast Cereals,380,5.7,88.5,2.2,5,56.2
785756,Cereal (General Mills Cheerios Yogurt Burst),Breakfast Cereals,400,6.67,81.75,5.23,6.7,30
785780,Burrito Taco Or Quesadilla With Egg,Fast Foods,229,10.27,19.69,11.84,1.4,2.48
785781,Burrito Taco Or Quesadilla With Egg And Potato,Fast Foods,235,9.04,21.15,12.66,1.6,2.18
785782,Burrito Taco Or Quesadilla With Egg And Breakfast Meat,Fast Foods,242,11.38,17.22,13.92,1.3,2.3
785784,Burrito Taco Or Quesadilla With Egg Potato And Breakfast Meat,Fast Foods,246,10.14,18.86,14.36,1.5,2.05
785785,Burrito Taco Or Quesadilla With Egg Potato And Breakfast Meat From Fast Food,Fast Foods,242,11.15,17.76,13.94,1.3,2.19
785786,Burrito Taco Or Quesadilla With Egg Beans And Breakfast Meat,Fast Foods,224,10.46,17.32,12.47,2,2.02
785787,Burrito With Meat,Prepared Meals,242,13.03,14.44,14.48,1.2,1.71
785788,Burrito With Meat And Beans,Prepared Meals,229,11.36,17.83,12.46,2.4,1.75
785790,Burrito With Meat And Sour Cream,Prepared Meals,236,11.57,13.09,15.15,1.1,1.95
785791,Burrito With Meat Beans And Sour Cream,Prepared Meals,225,10.16,16.06,13.39,2.1,1.97
785792,Burrito With Meat Beans And Sour Cream From Fast Food,Prepared Meals,209,8.56,26.78,7.86,3.6,1.7
785793,Burrito With Meat Beans And Rice,Prepared Meals,223,10.79,18.52,11.66,2.3,1.64
785794,Burrito With Meat Beans Rice And Sour Cream,Prepared Meals,219,9.73,16.76,12.63,2,1.86
785795,Burrito With Chicken,Prepared Meals,242,16.9,16.57,12.01,1.4,1.84
785796,Burrito With Chicken And Beans,Prepared Meals,228,12.93,19.06,11.2,2.5,1.81
785797,Burrito With Chicken And Sour Cream,Prepared Meals,235,14.59,14.66,13.19,1.1,2.09
785798,Burrito With Chicken Beans And Sour Cream,Prepared Meals,224,11.42,16.98,12.38,2.2,2.04
785799,Burrito With Chicken Beans And Rice,Prepared Meals,221,12.2,19.72,10.42,2.4,1.68
785800,Burrito With Chicken Beans Rice And Sour Cream,Prepared Meals,218,10.88,17.67,11.63,2.1,1.92
785801,Burrito With Beans And Rice Meatless,Prepared Meals,211,9.32,21.5,9.89,3.3,1.68
785802,Burrito With Beans Meatless,Prepared Meals,217,9.78,21.04,10.56,3.5,1.79
785804,Burrito With Beans Rice And Sour Cream Meatless,Prepared Meals,210,8.47,19.41,11.06,2.9,1.89
785805,Chilaquiles Tortilla Casserole With Salsa Cheese And Egg,Prepared Meals,292,8.57,24.71,17.84,2.7,2.98
785806,Chilaquiles Tortilla Casserole With Salsa And Cheese No Egg,Prepared Meals,299,7.3,28.98,17.4,3.2,3.43
785807,Enchilada With Meat And Beans Red-Chile Or Enchilada Sauce,Prepared Meals,139,6.83,14.4,6.42,2.6,2.57
785808,Enchilada With Meat And Beans Green-Chile Or Enchilada Sauce,Prepared Meals,157,7.23,14.68,8.16,2.8,2.1
785809,Enchilada With Meat Red-Chile Or Enchilada Sauce,Prepared Meals,147,9.22,12.22,7.15,1.8,2.63
785810,Enchilada With Meat Green-Chile Or Enchilada Sauce,Prepared Meals,168,9.83,12.37,9.08,2,2.12
785811,Enchilada With Chicken And Beans Red-Chile Or Enchilada Sauce,Prepared Meals,131,6.48,14.39,5.81,2.6,2.56
785812,Enchilada With Chicken And Beans Green-Chile Or Enchilada Sauce,Prepared Meals,149,6.86,14.67,7.5,2.8,2.1
785813,Enchilada With Chicken Red-Chile Or Enchilada Sauce,Prepared Meals,130,8.47,12.21,5.82,1.8,2.62
785814,Enchilada With Chicken Green-Chile Or Enchilada Sauce,Prepared Meals,150,9.02,12.35,7.65,2,2.12
785815,Enchilada With Beans Meatless Red-Chile Or Enchilada Sauce,Prepared Meals,131,4.75,16.28,5.8,3.3,2.52
785816,Enchilada With Beans Green-Chile Or Enchilada Sauce,Prepared Meals,148,5,16.66,7.37,3.5,2.08
785817,Enchilada Just Cheese Meatless No Beans Red-Chile Or Enchilada Sauce,Prepared Meals,167,7.31,12.88,10.06,1.9,2.78
785818,Enchilada Just Cheese Meatless No Beans Green-Chile Or Enchilada Sauce,Prepared Meals,189,7.8,13.08,12.28,2,2.28
785819,Taco Or Tostada With Meat,Prepared Meals,246,10.45,19.28,14.31,2.7,2.32
785821,Taco Or Tostada With Meat And Sour Cream,Prepared Meals,243,9.44,17.44,15.25,2.3,2.51
785822,Soft Taco With Meat,Prepared Meals,221,10.68,20.42,10.71,2.1,3.01
785824,Soft Taco With Meat And Sour Cream,Prepared Meals,221,9.75,18.64,11.97,1.9,3.1
785825,Soft Taco With Meat And Sour Cream From Fast Food,Prepared Meals,200,8.68,18.78,9.96,2.6,1.44
785826,Soft Taco With Chicken,Prepared Meals,221,12.5,21.28,9.58,2,2.37
785828,Soft Taco With Chicken And Sour Cream,Prepared Meals,218,11.07,18.91,10.97,1.7,2.52
785829,Taco Or Tostada With Chicken,Prepared Meals,255,12.74,20.44,13.78,2.6,1.51
785830,Taco Or Tostada With Chicken And Sour Cream,Prepared Meals,245,11.06,17.87,14.69,2.2,1.82
785831,Taco Or Tostada With Fish,Prepared Meals,229,10.07,20.44,11.91,2.6,1.52
785832,Soft Taco With Fish,Prepared Meals,199,10.22,21.28,8.01,2,2.38
785833,Soft Taco With Beans,Prepared Meals,184,6.88,23.63,7.01,4,1.99
785834,Soft Taco With Beans And Sour Cream,Prepared Meals,185,6.42,21.66,8.29,3.6,2.13
785835,Soft Taco With Meat And Beans,Prepared Meals,201,8.58,22.29,8.67,3.2,2.44
785836,Soft Taco With Chicken And Beans,Prepared Meals,199,9.18,22.67,8.07,3.2,2.14
785837,Soft Taco With Meat Beans And Sour Cream,Prepared Meals,202,7.92,20.38,9.96,2.8,2.57
785838,Soft Taco With Chicken Beans And Sour Cream,Prepared Meals,199,8.37,20.5,9.42,2.8,2.3
785839,Taco Or Tostada With Beans,Prepared Meals,202,6.39,23.34,9.51,4.6,1.37
785840,Taco Or Tostada With Beans And Sour Cream,Prepared Meals,201,5.94,21.2,10.63,4.1,1.6
785841,Taco Or Tostada With Meat And Beans,Prepared Meals,222,8.19,21.65,11.65,3.8,1.79
785842,Taco Or Tostada With Meat And Beans From Fast Food,Prepared Meals,219,8.61,19.66,12.06,4,0.88
785843,Taco Or Tostada With Chicken And Beans,Prepared Meals,223,8.91,22.19,11.21,3.8,1.43
785844,Taco Or Tostada With Meat Beans And Sour Cream,Prepared Meals,220,7.51,19.6,12.71,3.3,2.01
785845,Taco Or Tostada With Chicken Beans And Sour Cream,Prepared Meals,219,8.04,19.83,12.3,3.3,1.69
785846,Ground Beef With Tomato Sauce And Taco Seasonings On A Cornbread Crust,Prepared Meals,194,9.56,20.49,8.13,2.6,7.04
785847,Mexican Casserole Made With Ground Beef Beans Tomato Sauce Cheese Taco Seasonings And Corn Chips,Prepared Meals,234,13.28,17.41,12.65,3.1,1.13
785848,Mexican Casserole Made With Ground Beef Tomato Sauce Cheese Taco Seasonings And Corn Chips,Prepared Meals,268,14.62,14.51,17.08,1.6,1.42
785849,Taco Or Tostada Salad With Meat,Prepared Meals,178,7.47,16.44,9.3,2.9,1.81
785850,Taco Or Tostada Salad With Chicken,Prepared Meals,166,7.85,16.24,8,2.9,1.79
785851,Taco Or Tostada Salad Meatless,Prepared Meals,161,5.29,19.25,7.33,3.8,1.84
785852,Taco Or Tostada Salad With Meat And Sour Cream,Prepared Meals,180,6.86,15.02,10.51,2.6,2
785853,Taco Or Tostada Salad With Chicken And Sour Cream,Prepared Meals,170,7.2,14.86,9.35,2.5,1.98
785854,Taco Or Tostada Salad Meatless With Sour Cream,Prepared Meals,166,4.95,17.47,8.8,3.3,2.04
785856,Tamale With Chicken,Prepared Meals,221,8.6,14.94,14.37,1.3,0.55
785857,Tamale Plain Meatless No Sauce Puerto Rican Style Or Carribean Style,Prepared Meals,216,1.88,11.68,18.82,1.6,3.52
785858,Tamale Meatless With Sauce Puerto Rican Or Caribbean Style,Prepared Meals,451,1.46,9.25,46.07,1.6,2.52
785860,Tamale Casserole With Meat,Prepared Meals,160,6.31,15.43,8.25,1.7,2.02
785861,Nachos With Cheese And Sour Cream,Prepared Meals,223,8.4,21.93,11.84,4,1.73
785863,Nachos With Meat And Cheese,Prepared Meals,235,13.48,17.88,12.41,3.3,1.11
785864,Nachos With Chicken And Cheese,Prepared Meals,209,14.13,17.43,9.59,3.2,1.09
785865,Nachos With Chili,Prepared Meals,252,10.05,23.12,14.07,3,1.2
785866,Nachos With Meat Cheese And Sour Cream,Prepared Meals,216,6.28,20.08,12.63,3.4,1.51
785867,Nachos With Chicken Cheese And Sour Cream,Prepared Meals,208,13.11,16.31,10.44,2.9,1.29
785868,Gordita Sope Or Chalupa With Beans,Prepared Meals,209,6.52,25.58,9.32,4.2,1.78
785869,Gordita Sope Or Chalupa With Beans And Sour Cream,Prepared Meals,208,6.15,23.72,10.22,3.8,1.93
785870,Gordita Sope Or Chalupa With Meat And Sour Cream,Prepared Meals,247,9.01,22.03,13.89,2.5,2.73
785871,Gordita Sope Or Chalupa With Meat,Prepared Meals,250,9.7,23.87,13.06,2.7,2.62
785872,Gordita Sope Or Chalupa With Chicken And Sour Cream,Prepared Meals,242,9.86,22.11,12.97,2.3,2.18
785873,Gordita Sope Or Chalupa With Chicken,Prepared Meals,248,10.83,24.4,12.14,2.6,2.02
785874,Chimichanga With Meat,Prepared Meals,260,9.15,27.83,12.55,3.4,2.73
785875,Chimichanga Meatless,Prepared Meals,225,7.11,26.92,10.04,3.9,2.16
785876,Chimichanga With Chicken,Prepared Meals,272,10.1,29.56,12.65,3.5,2.58
785877,Chimichanga With Meat And Sour Cream,Prepared Meals,282,9,27.23,15.3,2.3,3.37
785878,Chimichanga Meatless With Sour Cream,Prepared Meals,223,6.68,24.89,10.89,3.5,2.28
785879,Chimichanga With Chicken And Sour Cream,Prepared Meals,266,9.33,27.02,13.55,3.2,2.7
785880,Quesadilla Just Cheese Meatless,Prepared Meals,343,12.63,32.76,17.75,2.3,2.63
785881,Quesadilla Just Cheese From Fast Food,Prepared Meals,346,13.28,30.07,18.96,2.1,2.48
785882,Quesadilla With Meat,Prepared Meals,326,14.4,29.28,16.58,2,2.35
785885,Quesadilla With Vegetables,Prepared Meals,307,11.3,29.64,15.74,2.2,2.7
785886,Quesadilla With Vegetables And Meat,Prepared Meals,317,12.84,29.46,16.16,2.1,2.52
785887,Quesadilla With Vegetables And Chicken,Prepared Meals,315,12.72,29.45,16.13,2.1,2.52
785888,Taquito Or Flauta With Cheese,Prepared Meals,269,10.4,33.27,11.18,4.6,0.77
785893,Taquito Or Flauta With Egg,Fast Foods,255,10.06,27.37,11.39,2,2.66
785894,Taquito Or Flauta With Egg And Breakfast Meat,Fast Foods,267,11.38,25.94,12.7,1.9,2.52
785895,Fajita With Chicken And Vegetables,Prepared Meals,161,9.72,14.76,7.13,1.6,2.78
785896,Fajita With Meat And Vegetables,Prepared Meals,165,10.41,14.76,6.99,1.6,2.78
785897,Fajita With Vegetables,Prepared Meals,161,5.47,15.89,8.61,1.9,3.44
785899,Pupusa Bean-Filled,Prepared Meals,181,5.71,29.79,4.84,3.5,1.07
785908,Pizza Cheese From School Lunch Medium Crust,Baked Foods,250,13.67,29.7,8.59,3.4,6.07
785911,Pizza Extra Cheese Thin Crust,Baked Foods,302,13.46,29.76,14.28,2.4,3.51
785912,Pizza Extra Cheese Thick Crust,Baked Foods,272,11.42,31.88,10.97,2.1,3.27
785913,Pizza Cheese With Vegetables From Frozen Thin Crust,Baked Foods,240,9.24,26.51,10.81,2.1,3.62
785914,Pizza Cheese With Vegetables From Frozen Thick Crust,Baked Foods,245,11.64,31.31,8.22,2.4,5.02
785915,Pizza Cheese With Vegetables From Restaurant Or Fast Food Thin Crust,Baked Foods,265,11.22,28.02,12.03,2.3,3.66
785916,Pizza Cheese With Vegetables From Restaurant Or Fast Food Medium Crust,Baked Foods,242,10.31,30.71,8.69,2.2,3.62
785917,Pizza Cheese With Vegetables From Restaurant Or Fast Food Thick Crust,Baked Foods,245,9.74,30.43,9.39,2.1,3.41
785918,Pizza With Cheese And Extra Vegetables Thin Crust,Baked Foods,233,9.63,24.46,10.86,2.4,3.32
785919,Pizza With Cheese And Extra Vegetables Medium Crust,Baked Foods,220,9.21,27.64,8.22,2.2,3.36
785920,Pizza With Cheese And Extra Vegetables Thick Crust,Baked Foods,240,9.46,29.46,9.45,2.2,3.23
785921,Pizza Cheese With Fruit Thin Crust,Baked Foods,260,10.72,28.5,11.56,2.3,5.45
785922,Pizza Cheese With Fruit Medium Crust,Baked Foods,239,9.96,31,8.43,2.2,4.98
785923,Pizza Cheese With Fruit Thick Crust,Baked Foods,246,9.58,31.06,9.29,2.1,4.65
785924,Pizza With Pepperoni From Frozen Thin Crust,Baked Foods,274,12.25,27.52,12.71,2.9,3.54
785925,Pizza With Pepperoni From Frozen Medium Crust,Baked Foods,271,12.43,29.68,11.38,2.6,4.23
785926,Pizza With Pepperoni From Frozen Thick Crust,Baked Foods,268,12.6,31.83,10.05,2.4,4.92
785931,Pizza With Pepperoni Stuffed Crust,Baked Foods,296,12.92,27.19,15.01,1.5,2.62
785933,Pizza With Pepperoni From School Lunch Medium Crust,Baked Foods,256,13.56,29.77,9.22,4.3,5.82
785935,Pizza With Meat Other Than Pepperoni From Frozen Thin Crust,Baked Foods,269,12.4,27.13,12.18,2.8,3.58
785936,Pizza With Meat Other Than Pepperoni From Frozen Medium Crust,Baked Foods,266,12.56,29.3,10.94,2.6,4.26
785937,Pizza With Meat Other Than Pepperoni From Frozen Thick Crust,Baked Foods,264,12.71,31.48,9.71,2.4,4.93
785942,Pizza With Meat Other Than Pepperoni Stuffed Crust,Baked Foods,281,12.9,27.49,13.16,1.5,2.8
785943,Pizza With Meat Other Than Pepperoni From School Lunch Medium Crust,Baked Foods,254,12.94,31.41,8.45,4,5.62
785946,Pizza With Extra Meat Thin Crust,Baked Foods,306,16.04,22.86,16.51,1.8,2.73
785947,Pizza With Extra Meat Medium Crust,Baked Foods,277,14.05,26.73,12.46,1.8,2.94
785948,Pizza With Extra Meat Thick Crust,Baked Foods,280,13.53,26.75,13.08,1.8,2.76
785952,Pizza With Meat And Vegetables From Restaurant Or Fast Food Thin Crust,Baked Foods,271,12.72,25.12,13.2,2.1,3.34
785954,Pizza With Meat And Vegetables From Restaurant Or Fast Food Thick Crust,Baked Foods,260,10.97,30.16,10.56,2,3.24
785955,Pizza With Extra Meat And Extra Vegetables Thin Crust,Baked Foods,248,12.53,22.4,12.06,2.1,2.99
785956,Pizza With Extra Meat And Extra Vegetables Thick Crust,Baked Foods,240,11.06,26.53,10.01,2,2.96
785957,Pizza With Extra Meat And Extra Vegetables Medium Crust,Baked Foods,234,11.51,26.1,9.33,2,3.11
785958,Pizza With Meat And Fruit Thin Crust,Baked Foods,254,11.98,25.6,11.51,2,4.5
785959,Pizza With Meat And Fruit Medium Crust,Baked Foods,234,10.98,28.36,8.58,2,4.3
785960,Pizza With Meat And Fruit Thick Crust,Baked Foods,245,10.58,29.26,9.52,2,3.95
785961,Pizza With Beans And Vegetables Thin Crust,Baked Foods,226,10.24,25.22,9.48,3.3,2.75
785962,Pizza With Beans And Vegetables Thick Crust,Baked Foods,225,9.44,28.48,8.18,2.8,2.8
785963,Pizza No Cheese Thin Crust,Baked Foods,276,7.38,30.77,13.64,2,4.94
785964,Pizza No Cheese Thick Crust,Baked Foods,292,7.41,37.95,12.13,2.1,5.4
785965,White Pizza Cheese Thin Crust,Baked Foods,294,12.18,27.48,14.88,1.7,1.97
785966,White Pizza Cheese Thick Crust,Baked Foods,289,11.48,32.16,12.53,2,2.22
785967,White Pizza Cheese With Vegetables Thin Crust,Baked Foods,248,9.95,23.53,12.65,1.7,2.11
785968,White Pizza Cheese With Vegetables Thick Crust,Baked Foods,252,9.76,28.11,11.07,2,2.29
785969,White Pizza Cheese With Meat Thin Crust,Baked Foods,314,13.48,22.95,18.49,1.4,1.82
785970,White Pizza Cheese With Meat Thick Crust,Baked Foods,307,12.67,27.69,15.87,1.7,2.06
785971,White Pizza Cheese With Meat And Vegetables Thin Crust,Baked Foods,281,12.01,21.21,16.3,1.4,2.08
785972,White Pizza Cheese With Meat And Vegetables Thick Crust,Baked Foods,279,11.51,25.75,14.29,1.7,2.25
785973,Calzone With Cheese Meatless,Baked Foods,385,17.41,28.83,22.05,1.3,0.46
785974,Calzone With Meat And Cheese,Baked Foods,348,14.28,31.16,18.24,1.4,0.49
785975,Pizza Rolls,Baked Foods,345,9.19,53.39,10.5,1.3,3.94
785976,Pizza Cheese Whole Wheat Thin Crust,Baked Foods,273,11.04,28.88,13.28,4.1,2.57
785977,Pizza Cheese Whole Wheat Thick Crust,Baked Foods,272,10.69,33.54,11.26,4.5,2.65
785978,Pizza With Meat Whole Wheat Thin Crust,Baked Foods,297,12.57,24.04,17.22,3.3,2.31
785979,Pizza With Meat Whole Wheat Thick Crust,Baked Foods,292,12,28.83,14.81,3.8,2.42
785980,Pizza Cheese And Vegetables Whole Wheat Thin Crust,Baked Foods,231,9.02,24.61,11.35,3.6,2.58
785981,Pizza Cheese And Vegetables Whole Wheat Thick Crust,Baked Foods,237,9.08,29.23,9.99,4.1,2.65
785982,Pizza Cheese Gluten-Free Thin Crust,Baked Foods,264,8.32,25.84,14.16,2.5,2.9
785983,Pizza Cheese Gluten-Free Thick Crust,Baked Foods,261,7.49,30,12.3,2.9,3.04
785984,Pizza With Meat Gluten-Free Thin Crust,Baked Foods,290,10.36,21.58,17.93,2.1,2.58
785985,Pizza With Meat Gluten-Free Thick Crust,Baked Foods,283,9.3,25.84,15.69,2.5,2.75
785986,Pizza Cheese And Vegetables Gluten-Free Thin Crust,Baked Foods,223,6.85,22.19,12.05,2.4,2.85
785987,Pizza Cheese And Vegetables Gluten-Free Thick Crust,Baked Foods,228,6.41,26.28,10.86,2.7,2.97
785988,Breakfast Pizza With Egg,Fast Foods,297,13.19,26.21,15.21,1.6,2.11
785989,Egg Roll Meatless,Prepared Meals,269,5.62,30.02,14.14,2.3,5.63
785990,Egg Roll With Shrimp,Prepared Meals,269,5.62,30.02,14.14,2.3,5.63
785991,Egg Roll With Beef And/or Pork,Prepared Meals,277,9.39,27.87,14.33,2,5.03
785992,Egg Roll With Chicken Or Turkey,Prepared Meals,253,9.86,26.96,11.82,2.3,5.26
785993,Roll With Meat And/or Shrimp Vegetables And Rice Paper Not Fried,Prepared Meals,111,5.53,17.13,2.63,2.1,3.91
785994,Wonton Fried Filled With Meat Poultry Or Seafood,Prepared Meals,191,8.76,14.05,11.13,1.5,2.92
785995,Wonton Fried Meatless,Prepared Meals,191,8.76,14.05,11.13,1.5,2.92
785996,Wonton Fried Filled With Meat Poultry Or Seafood And Vegetable,Prepared Meals,191,8.76,14.05,11.13,1.5,2.92
785997,Puffs Fried Crab Meat And Cream Cheese Filled,Prepared Meals,315,9.3,35.01,15.22,1.2,3.6
785998,Dumpling Steamed Filled With Meat Poultry Or Seafood,Prepared Meals,113,6.9,11.07,4.6,1.2,2.3
785999,Tamale Casserole Puerto Rican Style,Prepared Meals,157,6.98,11.04,9.67,1.5,2.1
786000,Tamal In A Leaf Puerto Rican Style,Prepared Meals,153,9.42,11.78,8.16,1.5,5.66
786001,Taco With Crab Meat Puerto Rican Style,Prepared Meals,218,12.03,16.63,11.33,1.2,1.19
786002,Meat Turnover Puerto Rican Style,Prepared Meals,256,11.89,21.62,13.34,1.1,1.55
786003,Empanada Mexican Turnover Filled With Cheese And Vegetables,Prepared Meals,319,8.61,34.39,16.58,1.6,4.75
786005,Empanada Mexican Turnover Filled With Chicken And Vegetables,Prepared Meals,285,9.66,33.18,12.77,1.5,4.44
786006,Meat Pie Puerto Rican Style,Prepared Meals,475,15.7,25.36,33.99,1.1,0.52
786007,Cheese Turnover Puerto Rican Style,Prepared Meals,420,9.68,36.79,25.71,1.3,0.23
786008,Cornmeal Fritter Puerto Rican Style,Baked Foods,266,6.77,20.78,17.21,1,0.52
786009,Cornmeal Stick Puerto Rican Style,Baked Foods,410,6.94,48.5,20.58,2.4,1.03
786013,Cornstarch Coconut Dessert Puerto Rican Style,Sweets,279,2.18,20.87,22.51,2.1,13.03
786014,Cornmeal Coconut Dessert Puerto Rican Style,Sweets,292,2.82,27.72,20.49,2.3,16.3
